[{"facultad": "Facultad de Arquitectura", "carrera": "Arquitectura", "ciclo": "10° Ciclo", "promotores": 14, "pasivos": 5, "detractores": 1, "score": 65.0}, {"facultad": "Facultad de Arquitectura", "carrera": "Arquitectura", "ciclo": "1° Ciclo", "promotores": 33, "pasivos": 7, "detractores": 0, "score": 82.5}, {"facultad": "Facultad de Arquitectura", "carrera": "Arquitectura", "ciclo": "2° Ciclo", "promotores": 25, "pasivos": 10, "detractores": 0, "score": 71.43}, {"facultad": "Facultad de Arquitectura", "carrera": "Arquitectura", "ciclo": "3° Ciclo", "promotores": 30, "pasivos": 10, "detractores": 1, "score": 70.73}, {"facultad": "Facultad de Arquitectura", "carrera": "Arquitectura", "ciclo": "4° Ciclo", "promotores": 28, "pasivos": 3, "detractores": 0, "score": 90.32}, {"facultad": "Facultad de Arquitectura", "carrera": "Arquitectura", "ciclo": "5° Ciclo", "promotores": 72, "pasivos": 11, "detractores": 0, "score": 86.75}, {"facultad": "Facultad de Arquitectura", "carrera": "Arquitectura", "ciclo": "6° Ciclo", "promotores": 11, "pasivos": 5, "detractores": 1, "score": 58.82}, {"facultad": "Facultad de Arquitectura", "carrera": "Arquitectura", "ciclo": "7° Ciclo", "promotores": 32, "pasivos": 10, "detractores": 1, "score": 72.09}, {"facultad": "Facultad de Arquitectura", "carrera": "Arquitectura", "ciclo": "8° Ciclo", "promotores": 17, "pasivos": 9, "detractores": 4, "score": 43.33}, {"facultad": "Facultad de Arquitectura", "carrera": "Arquitectura", "ciclo": "9° Ciclo", "promotores": 21, "pasivos": 9, "detractores": 0, "score": 70.0}, {"facultad": "Facultad de Ciencias Empresariales", "carrera": "Administración", "ciclo": "10° Ciclo", "promotores": 17, "pasivos": 4, "detractores": 0, "score": 80.95}, {"facultad": "Facultad de Ciencias Empresariales", "carrera": "Administración", "ciclo": "1° Ciclo", "promotores": 29, "pasivos": 15, "detractores": 4, "score": 52.08}, {"facultad": "Facultad de Ciencias Empresariales", "carrera": "Administración", "ciclo": "2° Ciclo", "promotores": 23, "pasivos": 4, "detractores": 0, "score": 85.19}, {"facultad": "Facultad de Ciencias Empresariales", "carrera": "Administración", "ciclo": "3° Ciclo", "promotores": 50, "pasivos": 17, "detractores": 1, "score": 72.06}, {"facultad": "Facultad de Ciencias Empresariales", "carrera": "Administración", "ciclo": "4° Ciclo", "promotores": 22, "pasivos": 8, "detractores": 2, "score": 62.5}, {"facultad": "Facultad de Ciencias Empresariales", "carrera": "Administración", "ciclo": "5° Ciclo", "promotores": 46, "pasivos": 8, "detractores": 2, "score": 78.57}, {"facultad": "Facultad de Ciencias Empresariales", "carrera": "Administración", "ciclo": "6° Ciclo", "promotores": 19, "pasivos": 12, "detractores": 0, "score": 61.29}, {"facultad": "Facultad de Ciencias Empresariales", "carrera": "Administración", "ciclo": "7° Ciclo", "promotores": 20, "pasivos": 8, "detractores": 0, "score": 71.43}, {"facultad": "Facultad de Ciencias Empresariales", "carrera": "Administración", "ciclo": "8° Ciclo", "promotores": 24, "pasivos": 9, "detractores": 2, "score": 62.86}, {"facultad": "Facultad de Ciencias Empresariales", "carrera": "Administración", "ciclo": "9° Ciclo", "promotores": 23, "pasivos": 3, "detractores": 1, "score": 81.48}, {"facultad": "Facultad de Ciencias Empresariales", "carrera": "Contabilidad y Finanzas", "ciclo": "10° Ciclo", "promotores": 7, "pasivos": 2, "detractores": 1, "score": 60.0}, {"facultad": "Facultad de Ciencias Empresariales", "carrera": "Contabilidad y Finanzas", "ciclo": "1° Ciclo", "promotores": 2, "pasivos": 2, "detractores": 0, "score": 50.0}, {"facultad": "Facultad de Ciencias Empresariales", "carrera": "Contabilidad y Finanzas", "ciclo": "2° Ciclo", "promotores": 3, "pasivos": 1, "detractores": 0, "score": 75.0}, {"facultad": "Facultad de Ciencias Empresariales", "carrera": "Contabilidad y Finanzas", "ciclo": "3° Ciclo", "promotores": 25, "pasivos": 4, "detractores": 0, "score": 86.21}, {"facultad": "Facultad de Ciencias Empresariales", "carrera": "Contabilidad y Finanzas", "ciclo": "4° Ciclo", "promotores": 23, "pasivos": 3, "detractores": 0, "score": 88.46}, {"facultad": "Facultad de Ciencias Empresariales", "carrera": "Contabilidad y Finanzas", "ciclo": "5° Ciclo", "promotores": 25, "pasivos": 7, "detractores": 0, "score": 78.12}, {"facultad": "Facultad de Ciencias Empresariales", "carrera": "Contabilidad y Finanzas", "ciclo": "6° Ciclo", "promotores": 20, "pasivos": 6, "detractores": 1, "score": 70.37}, {"facultad": "Facultad de Ciencias Empresariales", "carrera": "Contabilidad y Finanzas", "ciclo": "7° Ciclo", "promotores": 27, "pasivos": 4, "detractores": 1, "score": 81.25}, {"facultad": "Facultad de Ciencias Empresariales", "carrera": "Contabilidad y Finanzas", "ciclo": "8° Ciclo", "promotores": 28, "pasivos": 3, "detractores": 3, "score": 73.53}, {"facultad": "Facultad de Ciencias Empresariales", "carrera": "Contabilidad y Finanzas", "ciclo": "9° Ciclo", "promotores": 21, "pasivos": 3, "detractores": 0, "score": 87.5}, {"facultad": "Facultad de Ciencias Empresariales", "carrera": "Marketing", "ciclo": "10° Ciclo", "promotores": 28, "pasivos": 6, "detractores": 0, "score": 82.35}, {"facultad": "Facultad de Ciencias Empresariales", "carrera": "Marketing", "ciclo": "1° Ciclo", "promotores": 12, "pasivos": 0, "detractores": 0, "score": 100.0}, {"facultad": "Facultad de Ciencias Empresariales", "carrera": "Marketing", "ciclo": "2° Ciclo", "promotores": 11, "pasivos": 2, "detractores": 0, "score": 84.62}, {"facultad": "Facultad de Ciencias Empresariales", "carrera": "Marketing", "ciclo": "3° Ciclo", "promotores": 27, "pasivos": 8, "detractores": 1, "score": 72.22}, {"facultad": "Facultad de Ciencias Empresariales", "carrera": "Marketing", "ciclo": "4° Ciclo", "promotores": 23, "pasivos": 2, "detractores": 2, "score": 77.78}, {"facultad": "Facultad de Ciencias Empresariales", "carrera": "Marketing", "ciclo": "5° Ciclo", "promotores": 39, "pasivos": 11, "detractores": 3, "score": 67.92}, {"facultad": "Facultad de Ciencias Empresariales", "carrera": "Marketing", "ciclo": "6° Ciclo", "promotores": 18, "pasivos": 4, "detractores": 4, "score": 53.85}, {"facultad": "Facultad de Ciencias Empresariales", "carrera": "Marketing", "ciclo": "7° Ciclo", "promotores": 32, "pasivos": 3, "detractores": 0, "score": 91.43}, {"facultad": "Facultad de Ciencias Empresariales", "carrera": "Marketing", "ciclo": "8° Ciclo", "promotores": 30, "pasivos": 6, "detractores": 0, "score": 83.33}, {"facultad": "Facultad de Ciencias Empresariales", "carrera": "Marketing", "ciclo": "9° Ciclo", "promotores": 27, "pasivos": 5, "detractores": 0, "score": 84.38}, {"facultad": "Facultad de Ciencias Empresariales", "carrera": "Negocios Internacionales", "ciclo": "10° Ciclo", "promotores": 23, "pasivos": 0, "detractores": 0, "score": 100.0}, {"facultad": "Facultad de Ciencias Empresariales", "carrera": "Negocios Internacionales", "ciclo": "1° Ciclo", "promotores": 19, "pasivos": 5, "detractores": 1, "score": 72.0}, {"facultad": "Facultad de Ciencias Empresariales", "carrera": "Negocios Internacionales", "ciclo": "2° Ciclo", "promotores": 18, "pasivos": 10, "detractores": 0, "score": 64.29}, {"facultad": "Facultad de Ciencias Empresariales", "carrera": "Negocios Internacionales", "ciclo": "3° Ciclo", "promotores": 28, "pasivos": 2, "detractores": 0, "score": 93.33}, {"facultad": "Facultad de Ciencias Empresariales", "carrera": "Negocios Internacionales", "ciclo": "4° Ciclo", "promotores": 17, "pasivos": 6, "detractores": 2, "score": 60.0}, {"facultad": "Facultad de Ciencias Empresariales", "carrera": "Negocios Internacionales", "ciclo": "5° Ciclo", "promotores": 38, "pasivos": 6, "detractores": 2, "score": 78.26}, {"facultad": "Facultad de Ciencias Empresariales", "carrera": "Negocios Internacionales", "ciclo": "6° Ciclo", "promotores": 29, "pasivos": 7, "detractores": 2, "score": 71.05}, {"facultad": "Facultad de Ciencias Empresariales", "carrera": "Negocios Internacionales", "ciclo": "7° Ciclo", "promotores": 31, "pasivos": 10, "detractores": 2, "score": 67.44}, {"facultad": "Facultad de Ciencias Empresariales", "carrera": "Negocios Internacionales", "ciclo": "8° Ciclo", "promotores": 21, "pasivos": 3, "detractores": 1, "score": 80.0}, {"facultad": "Facultad de Ciencias Empresariales", "carrera": "Negocios Internacionales", "ciclo": "9° Ciclo", "promotores": 21, "pasivos": 3, "detractores": 0, "score": 87.5}, {"facultad": "Facultad de Comunicación", "carrera": "Comunicación", "ciclo": "10° Ciclo", "promotores": 12, "pasivos": 3, "detractores": 0, "score": 80.0}, {"facultad": "Facultad de Comunicación", "carrera": "Comunicación", "ciclo": "1° Ciclo", "promotores": 35, "pasivos": 10, "detractores": 1, "score": 73.91}, {"facultad": "Facultad de Comunicación", "carrera": "Comunicación", "ciclo": "2° Ciclo", "promotores": 21, "pasivos": 8, "detractores": 2, "score": 61.29}, {"facultad": "Facultad de Comunicación", "carrera": "Comunicación", "ciclo": "3° Ciclo", "promotores": 41, "pasivos": 10, "detractores": 3, "score": 70.37}, {"facultad": "Facultad de Comunicación", "carrera": "Comunicación", "ciclo": "4° Ciclo", "promotores": 23, "pasivos": 7, "detractores": 0, "score": 76.67}, {"facultad": "Facultad de Comunicación", "carrera": "Comunicación", "ciclo": "5° Ciclo", "promotores": 41, "pasivos": 7, "detractores": 2, "score": 78.0}, {"facultad": "Facultad de Comunicación", "carrera": "Comunicación", "ciclo": "6° Ciclo", "promotores": 14, "pasivos": 7, "detractores": 1, "score": 59.09}, {"facultad": "Facultad de Comunicación", "carrera": "Comunicación", "ciclo": "7° Ciclo", "promotores": 41, "pasivos": 6, "detractores": 2, "score": 79.59}, {"facultad": "Facultad de Comunicación", "carrera": "Comunicación", "ciclo": "8° Ciclo", "promotores": 27, "pasivos": 9, "detractores": 4, "score": 57.5}, {"facultad": "Facultad de Comunicación", "carrera": "Comunicación", "ciclo": "9° Ciclo", "promotores": 17, "pasivos": 11, "detractores": 1, "score": 55.17}, {"facultad": "Facu